"name","mrp"
"Patanjali Cow's Ghee","565.00"
"MamyPoko Pants Standard Diapers, Extra Large (12 - 17 kg)","399.00"
"Aashirvaad Atta With Mutigrains","315.00"
"Everest Kashmiri Lal Chilli Powder","310.00"
"Hershey's Cocoa + Almond Spread","295.00"
"Madhur Pure And Hygienic Sugar","295.00"
"RRO Mozzarella Block Cheese","295.00"
"Godrej Real Good Chicken Boneless Cubes ","275.00"
"Zorabian Chicken Cubes","270.00"
"Kelloggs Corn Flakes With Real Strawberry Pure","265.00"
"Del Monte Pitted Green Olives","250.00"
"Origami Plates Plain","250.00"
"Yummiez Green Peas","250.00"
"Zorabian Chicken Leg Boneless ","250.00"
"Zorabian Chicken Mince","250.00"
"Gillette Venus Close & Clean Razor ","249.00"
"Comfort After Wash Fabric Conditioner Lily Fresh ","235.00"
"Britannia Good Day Cashew Cookies","230.00"
"Fresh Chicken Mince - Kheema (Halal)","215.00"
"Parachute Advansed Gold Coconut Hair Oil","215.00"
"Fortune Soyabean Oil","210.00"
"India Gate Basmati Rice","210.00"
"Surf Excel Quick Wash","208.00"
"Gala No Dust Broom","190.00"
"Zorabian Chicken Kheema Parathas","190.00"
"Daawat Super Basmati Rice","185.00"
"The Whole Truth Peanut Butter - Unsweetened & Crunchy","185.00"
"Whisper Bindazzz Night Sanitary Pads XL Plus","185.00"
"Tata Sampann Unpolished Toor Dal/Arhar Dal","179.00"
"Chef's Basket Durum Wheat Penne Pasta","160.00"
"ITC Master Chef Cheesy Corn Triangles","160.00"
"Safal Frozen - Sweet Corn","160.00"
"Kissan Mixed Fruit Jam ","155.00"
"Dukes Waffy Chocolate Wafer Rolls ","150.00"
"Godrej Yummiez Chicken Breakfast Salami","150.00"
"Popular Essentials Phool Makhana (Jumbo Size)","150.00"
"Clean & Clear Morning Energy Lemon Face Wash","145.00"
"Zorabian Chicken Breast Boneless ","145.00"
"Fresh Chicken Curry Cut - Skinless (Halal)","140.00"
"Surf Excel Easy Wash Detergent Powder","136.00"
"Del Monte Eggless Mayo","135.00"
"Yummiez Green Peas","135.00"
"Bajaj Almond Drops Hair Oil Bottle","130.00"
"Go Cheese Pizza Blend Mozzarella + Cheddar","125.00"
"Popular Essentials Buckwheat Flour (Kuttu Atta)","125.00"
"Tata Sampann Kala Chana","125.00"
"Parachute 100% Pure Coconut Oil","123.00"
"Del Monte Original Blend Tomato Ketchup Pouch","120.00"
"Everest Saffron Kesar","120.00"
"Fortune Besan Flour","120.00"
"Satyam Singdana ","119.00"
"Dettol Effective Protection Antiseptic Liquid","116.00"
"Godrej Cinthol Lime Refreshing Deo Soap","116.00"
"Mother's Recipe Mixed Pickle ","115.00"
"Sensodyne Sensitive Fresh Gel Toothpaste","115.00"
"Dettol Original Liquid Handwash Refill","109.00"
"Keya Italian Pizza Oregano","109.00"
"Ching's Secret Veg Hakka Noodles","107.00"
"Chakaachak Eazo Grass Broom New ","105.00"
"Dabur Honitus Herbal Cough Remedy Ayurvedic Syrup","105.00"
"Open Secret Choco Almond Story Box","105.00"
"Pro Nature Organic Sonamasoori Brown Rice","102.00"
"Amul Pizza Cheese - Mozzarella","100.00"
"D'lecta Shredded Mozzarella Cheese","100.00"
"Godrej No.1 Bathing Soap – Lime & Aloe Vera","100.00"
"Pillsbury Pancake Mix - Funfetti","99.00"
"Sugarlite 50% Less Calories Sugar Pouch","99.00"
"Patanjali Pure Honey","95.00"
"Tata Sampann High Protien Toor Dal - Split","91.00"
"Top Ramen Masala","91.00"
"Closeup Everfresh+ Anti-Germ Gel Toothpaste Red Hot","90.00"
"Daawat Rozana Gold Basmati Rice","90.00"
"Odomos Mosquito Repellent Spray","90.00"
"Whisper Bindazzz Nights XL + Sanitary Pad","90.00"
"Whisper Choice Regular Sanitary Pads","90.00"
"Godrej Good Night Gold Flash Liquid Vapouriser","89.00"
"Nestle A+ Slim Milk","89.00"
"Tata Sampann Moong Chilka ","88.00"
"Rin Detergent Powder","86.00"
"Amul Cheese Spread Spicy Garlic","85.00"
"Amul Cheese Spread Yummy Plain","85.00"
"Yummiez American Sweet Corn","85.00"
"Godrej No.1 Bathing Soap, Jasmine","84.00"
"Oxylife Natural Radiance 5 Creme Bleach - With Active Oxygen","82.00"
"Britannia Marie Gold (Buy 4 Get 1 Free)","80.00"
"Cadbury Oreo Chocolatey Sandwich Biscuits Family Pack","80.00"
"Popular Essentials Toor Dal (Un-Polished)","80.00"
"Prabhat Malai Paneer Pouch","80.00"
"Scotch BOPP Packaging Tape","80.00"
"Daawat Rozana Super Basmati Rice","79.00"
"Dr Oetker Cucumber & Carrot Sandwich Spread Veg","79.00"
"Nestle A+ Slim Dahi - Low Fat","78.00"
"Amul Malai Paneer Fresh ","76.00"
"Amul Slim Trim Skimmed Milk","75.00"
"Britannia Nutrichoice 5 Grain Digestive Biscuits","75.00"
"Popular Essentials Sona Masouri Raw Rice","75.00"
"Suguna Vitamin D Egg","75.00"
"Maggi Special Masala Spicy Yummy Noodles","72.00"
"Suguna Nourish Egg ","72.00"
"Amul Cheese Slices","71.00"
"Britannia Milk Bikis Cream Biscuit","70.00"
"Everest Coriander Powder","70.00"
"Rin Fabric Whitener Detergent","69.00"
"Veeba Favourites Eggless Burger Mayonnaise","69.00"
"Bajaj Almond Drops Hair Oil","67.00"
"Everest Turmeric Powder","67.00"
"Amul Taaza Toned Homogenised Milk","66.00"
"Everest Chat Masala","65.00"
"Scotch-Brite Scrub Sponge Ideal For Dishwash Liquid","65.00"
"The Bake Shop Jeera Khari","65.00"
"The Bake Shop Maska Khari","65.00"
"The Bake Shop Multi Grain Bread","65.00"
"24 Mantra Organic Whole Wheat Atta","64.00"
"Tata Sampann High Protien Chana Dal - Split","64.00"
"Amul Fresh Cream","63.00"
"Suguna Nourish Egg","62.00"
"Fine Life Cotton Balls","60.00"
"Kellogg's Chocos Combo Pack","60.00"
"Lijjat Moong Papad","60.00"
"Lijjat Urad Papad","60.00"
"Madhur Sugar","60.00"
"Parle Monaco Sixer Salted Biscuits ","60.00"
"Popular Essentials Black Raisins Seedless","60.00"
"Popular Essentials Sabja/Basil Seeds","60.00"
"Popular Essentials Sabudana","60.00"
"Safal Frozen Mixed Vegetables","60.00"
"Maggi Masala Ae Magic","58.00"
"Del Monte Natural Vinegar ","55.00"
"Del Monte Schezwan Sauce","55.00"
"Popular Essentials Black Brown Chana (Un-Polished)","55.00"
"Eno Cooling Sachets - Cool Mint, 6 Pieces Carton","54.00"
"Aashirvaad Superior MP Whole Wheat Atta","53.00"
"Britannia Toastea Premium Bake Rusk","50.00"
"Dabur Ginger Garlic Paste","50.00"
"Maggi Chilly Chow Cuppa Noodles","50.00"
"Mother's Recipe Ginger And Garlic Paste","50.00"
"Popular Essentials Chia Seeds","50.00"
"Weikfield Falooda Mix - Mango","49.00"
"Dabur Gulabari Premium Rose Water","48.00"
"Sunfeast Yippee! Magic Masala Noodles","48.00"
"Everest Tikhalal Hot & Red Chilly Powder","47.00"
"Britannia Milk Bikis Cream Biscuit","45.00"
"Britannia Vita Marie Gold Biscuit","45.00"
"Vim Dishwash Bar","45.00"
"Maggi 2-Minute Instant Noodles - Masala","44.00"
"Tata Sampann Poha","44.00"
"Everest Amchur Powder","42.00"
"Stayfree Secure Dry Cover Extra Large Sanitary Pad","42.00"
"Safal Frozen Corn","41.00"
"Britannia Good Day Cashew Cookies Packet","40.00"
"Epigamia Fruit Yogurt Strawberry","40.00"
"Maggi Magic Cubes Chicken","40.00"
"Patanjali Atta Doodh Rusk","40.00"
"Popular Essentials Brown Sugar","40.00"
"The Bake Shop Whole Wheat Bread","40.00"
"The Bake Shop Whole Wheat Ladi Pav","40.00"
"Satyam Thin Poha Patla","38.00"
"Britannia Bourbon Chocolate Cream Biscuits","35.00"
"Britannia Cheese Garlic Bread","35.00"
"Britannia Nutri Choice Cracker Sugar Free Biscuit","35.00"
"Moong Sprouts","35.00"
"Parle Fab! Jam-In Cream Filled ","35.00"
"Pedigree Puppy Chicken Chunks in Gravy ","35.00"
"Satyam Poha Jada","35.00"
"Sunfeast Dark Fantasy Bourbon Bliss","35.00"
"Sunfeast Dark Fantasy Choco Fills","35.00"
"Tata Tea Gold","35.00"
"Everest Sambhar Masala","34.00"
"Everest Coriander Powder","32.00"
"Whisper Choice Sanitary Pad ","32.00"
"Mother's Recipe Potato Papad","31.00"
"Mothers Recipe Papad - Sabudana With Rock Salt","31.00"
"Britannia Atta Kulcha","30.00"
"Britannia Burger Bun with Sesame Seed","30.00"
"Britannia Marie Gold Biscuits Packet","30.00"
"Cadbury Oreo Creme Biscuit - Vanilla, Original 120 g","30.00"
"Cadbury Oreo Strawberry Bicuits","30.00"
"Dettol Antiseptic Liquid","30.00"
"Everest Cumin Powder (Jeera)","30.00"
"Stayfree Secure Cottony Soft Cover Sanitary Pad (Regular) with Wings","30.00"
"The Bake Shop Pizza Base Whole Wheat","30.00"
"Britannia Marie Gold Biscuit","28.00"
"Sunfeast Pasta Treat Pack of Tomato Cheese","28.00"
"Amul Lactose Free Milk","25.00"
"Britannia Classic Little Hearts ","25.00"
"Britannia Milk Bikis Milky Sandwich","25.00"
"Britannia Nice Time Biscuit","25.00"
"Britannia Nutri Choice Digestive Biscuits Packet","25.00"
"Britannia Nutri Choice Oats Choco Almond Biscuit","25.00"
"Britannia Treat Jimjam Cream Biscuits ","25.00"
"MTR Vegetable Upma","25.00"
"Sunfeast Nice Biscuit","25.00"
"Ujala Superme For Super Whiteness Of Clothes","25.00"
"Unibic Choco Nut Cookies","25.00"
"Mothers Recipe Rice Papad Ajwain","24.00"
"Vim Dishwash Bar","23.00"
"Aashirvaad Iodised Salt ","22.00"
"Britannia Good Day Cashew Cookies","20.00"
"Dabur Hommade - Imli Sauce Saunth","20.00"
"Kurkure Green Chutney, Rajasthani Style","20.00"
"Popular Essentials Mustard Seeds Rai Big","20.00"
"The Bake Shop Burger Buns","20.00"
"Bauli Moonfils - Vanilla","15.00"
"Bauli Moonfils Choco Cream (With Egg)","15.00"
"Bauli Moonfils Orange Puff Roll","15.00"
"Saffola Oats 100 % Natural","15.00"
"Carrot","13.00"
"Chakaachak Super Steel Scrubber","12.00"
"Beetroot","11.00"
"Britannia 50-50 Maska Chaska Biscuit","10.00"
"Britannia Roll Yo! Choco Swiss Roll (With Egg)","10.00"
"Britannia Roll Yo! Strawberry Swiss Roll","10.00"
"Ching's Chow Mein Hakka Noodles Masala","10.00"
"Good Day Butter Cookies","10.00"
"Rin Detergent Bar","10.00"
"Sunfeast Mom's Magic Cashew & Almond Biscuit","10.00"
